{
  "schema_version": "0.1.0",
  "catalog_kind": "issue_types",
  "catalog_status": "planning_proposal",
  "records": [
    {
      "issue_id": "IAM-001",
      "proposed_key": "microsoft_365_entra_id_sign_in_failure",
      "domain_code": "IAM",
      "labels": {
        "en": "Microsoft 365 / Entra ID sign-in failure",
        "fr": "Échec de connexion à Microsoft 365 / Entra ID"
      },
      "search_phrases": [
        {
          "text": "cloud sign-in failure",
          "language": "en",
          "review_status": "unreviewed"
        },
        {
          "text": "account access issue",
          "language": "en",
          "review_status": "unreviewed"
        }
      ],
      "possible_causes": [
        {
          "text": "authentication or account configuration",
          "language": "en",
          "evidence_status": "hypothesis_not_diagnosis"
        }
      ],
      "product_mentions": [
        "Microsoft 365",
        "Entra ID"
      ],
      "related_tool_ids": [
        "TOOL-003",
        "TOOL-012"
      ],
      "related_sop_ids": [],
      "tag_keys": [],
      "category_mapping": null,
      "entity_occurrences": [],
      "record_classification": "issue_type_definition",
      "lifecycle": "proposed",
      "source_reference": "User-provided OneNote and troubleshooting issue outline; HiloTech MSP experience narrative",
      "notes": "Existing stable issue ID retained; key/category/tags require Foundation 0C reconciliation."
    },
    {
      "issue_id": "IAM-002",
      "proposed_key": "windows_workstation_sign_in_failure",
      "domain_code": "IAM",
      "labels": {
        "en": "Windows workstation sign-in failure",
        "fr": "Échec de connexion à un poste Windows"
      },
      "search_phrases": [
        {
          "text": "Windows login issue",
          "language": "en",
          "review_status": "unreviewed"
        },
        {
          "text": "computer login problem",
          "language": "en",
          "review_status": "unreviewed"
        }
      ],
      "possible_causes": [
        {
          "text": "password synchronization",
          "language": "en",
          "evidence_status": "hypothesis_not_diagnosis"
        },
        {
          "text": "account status",
          "language": "en",
          "evidence_status": "hypothesis_not_diagnosis"
        }
      ],
      "product_mentions": [
        "Windows 10",
        "Windows 11"
      ],
      "related_tool_ids": [
        "TOOL-003",
        "TOOL-012"
      ],
      "related_sop_ids": [],
      "tag_keys": [],
      "category_mapping": null,
      "entity_occurrences": [],
      "record_classification": "issue_type_definition",
      "lifecycle": "proposed",
      "source_reference": "User-provided OneNote and troubleshooting issue outline; HiloTech MSP experience narrative",
      "notes": "Existing stable issue ID retained; key/category/tags require Foundation 0C reconciliation."
    },
    {
      "issue_id": "IAM-003",
      "proposed_key": "account_locked_out",
      "domain_code": "IAM",
      "labels": {
        "en": "Account locked out",
        "fr": "Compte verrouillé"
      },
      "search_phrases": [
        {
          "text": "user locked out",
          "language": "en",
          "review_status": "unreviewed"
        },
        {
          "text": "login lockout",
          "language": "en",
          "review_status": "unreviewed"
        }
      ],
      "possible_causes": [
        {
          "text": "account lockout policy",
          "language": "en",
          "evidence_status": "hypothesis_not_diagnosis"
        },
        {
          "text": "repeated failed login attempts",
          "language": "en",
          "evidence_status": "hypothesis_not_diagnosis"
        }
      ],
      "product_mentions": [
        "Entra ID",
        "Windows"
      ],
      "related_tool_ids": [
        "TOOL-003",
        "TOOL-012"
      ],
      "related_sop_ids": [
        "SOP-003"
      ],
      "tag_keys": [],
      "category_mapping": null,
      "entity_occurrences": [],
      "record_classification": "issue_type_definition",
      "lifecycle": "proposed",
      "source_reference": "User-provided OneNote and troubleshooting issue outline; HiloTech MSP experience narrative",
      "notes": "Existing stable issue ID retained; key/category/tags require Foundation 0C reconciliation."
    },
    {
      "issue_id": "IAM-004",
      "proposed_key": "password_reset_recovery_or_validation_failure",
      "domain_code": "IAM",
      "labels": {
        "en": "Password reset, recovery, or validation failure",
        "fr": "Échec de réinitialisation, de récupération ou de validation du mot de passe"
      },
      "search_phrases": [
        {
          "text": "password reset issue",
          "language": "en",
          "review_status": "unreviewed"
        },
        {
          "text": "account recovery issue",
          "language": "en",
          "review_status": "unreviewed"
        }
      ],
      "possible_causes": [
        {
          "text": "password or recovery workflow issue",
          "language": "en",
          "evidence_status": "hypothesis_not_diagnosis"
        }
      ],
      "product_mentions": [
        "Entra ID",
        "Microsoft 365"
      ],
      "related_tool_ids": [
        "TOOL-003",
        "TOOL-012"
      ],
      "related_sop_ids": [
        "SOP-003"
      ],
      "tag_keys": [],
      "category_mapping": null,
      "entity_occurrences": [],
      "record_classification": "issue_type_definition",
      "lifecycle": "proposed",
      "source_reference": "User-provided OneNote and troubleshooting issue outline; HiloTech MSP experience narrative",
      "notes": "Existing stable issue ID retained; key/category/tags require Foundation 0C reconciliation."
    },
    {
      "issue_id": "IAM-005",
      "proposed_key": "password_synchronization_failure",
      "domain_code": "IAM",
      "labels": {
        "en": "Password synchronization failure",
        "fr": "Échec de synchronisation du mot de passe"
      },
      "search_phrases": [
        {
          "text": "password desynchronization",
          "language": "en",
          "review_status": "unreviewed"
        }
      ],
      "possible_causes": [
        {
          "text": "password synchronization conflicts",
          "language": "en",
          "evidence_status": "hypothesis_not_diagnosis"
        }
      ],
      "product_mentions": [
        "Entra ID",
        "Windows"
      ],
      "related_tool_ids": [
        "TOOL-003",
        "TOOL-012"
      ],
      "related_sop_ids": [],
      "tag_keys": [],
      "category_mapping": null,
      "entity_occurrences": [],
      "record_classification": "issue_type_definition",
      "lifecycle": "proposed",
      "source_reference": "User-provided HiloTech MSP experience narrative",
      "notes": "Existing stable issue ID retained; key/category/tags require Foundation 0C reconciliation."
    },
    {
      "issue_id": "IAM-006",
      "proposed_key": "microsoft_authenticator_mfa_enrollment_failure",
      "domain_code": "IAM",
      "labels": {
        "en": "Microsoft Authenticator / MFA enrollment failure",
        "fr": "Échec de configuration de Microsoft Authenticator / MFA"
      },
      "search_phrases": [
        {
          "text": "MFA registration issue",
          "language": "en",
          "review_status": "unreviewed"
        },
        {
          "text": "Authenticator setup issue",
          "language": "en",
          "review_status": "unreviewed"
        }
      ],
      "possible_causes": [
        {
          "text": "enrollment or configuration issue",
          "language": "en",
          "evidence_status": "hypothesis_not_diagnosis"
        }
      ],
      "product_mentions": [
        "Microsoft Authenticator",
        "Entra ID"
      ],
      "related_tool_ids": [
        "TOOL-003",
        "TOOL-012"
      ],
      "related_sop_ids": [
        "SOP-004"
      ],
      "tag_keys": [],
      "category_mapping": null,
      "entity_occurrences": [],
      "record_classification": "issue_type_definition",
      "lifecycle": "proposed",
      "source_reference": "User-provided OneNote and troubleshooting issue outline; HiloTech MSP experience narrative",
      "notes": "Existing stable issue ID retained; key/category/tags require Foundation 0C reconciliation."
    },
    {
      "issue_id": "IAM-007",
      "proposed_key": "mfa_challenge_failure_or_authentication_lockout",
      "domain_code": "IAM",
      "labels": {
        "en": "MFA challenge failure or authentication lockout",
        "fr": "Échec de validation MFA ou blocage de l’authentification"
      },
      "search_phrases": [
        {
          "text": "MFA lockout",
          "language": "en",
          "review_status": "unreviewed"
        },
        {
          "text": "MFA verification issue",
          "language": "en",
          "review_status": "unreviewed"
        }
      ],
      "possible_causes": [
        {
          "text": "factor access or verification issue",
          "language": "en",
          "evidence_status": "hypothesis_not_diagnosis"
        }
      ],
      "product_mentions": [
        "Entra ID",
        "Microsoft Authenticator"
      ],
      "related_tool_ids": [
        "TOOL-003",
        "TOOL-012"
      ],
      "related_sop_ids": [
        "SOP-004"
      ],
      "tag_keys": [],
      "category_mapping": null,
      "entity_occurrences": [],
      "record_classification": "issue_type_definition",
      "lifecycle": "proposed",
      "source_reference": "User-provided OneNote and troubleshooting issue outline; HiloTech MSP experience narrative",
      "notes": "Existing stable issue ID retained; key/category/tags require Foundation 0C reconciliation."
    },
    {
      "issue_id": "IAM-008",
      "proposed_key": "conditional_access_unexpectedly_blocks_access",
      "domain_code": "IAM",
      "labels": {